{
  "ablation": {
    "contentSha256": "e8a7dbe9fdb4e3bd5b5c0b2a09f93ed9a62dc647b5d52cf1337fcb1f91284762",
    "id": "rca-20260807T084925Z-7139cbdc0378",
    "scheduleSha256": "278339dddc7268f8929c269028c9f96d37cf9ee63dac54e2abc015ef44b90a1c"
  },
  "arms": [
    {
      "adjudicationContentSha256": "d118f455c63c2af5bbf54ee7b80454e04fae32d5e3ae74f9e90ce572242be319",
      "goldenEligible": true,
      "runContentSha256": "f0c63540fda05218084aab86845db67717b535d4322dffdc19ff977cd45a29fc",
      "runId": "rce-20260807T084925Z-31e1ef737e67",
      "semanticMetrics": {
        "contaminatedNegativeCases": 2,
        "falsePositiveFindings": 2,
        "missedSeededIssues": 1,
        "negativeCases": 6,
        "positiveCases": 6,
        "resolvedCases": 12,
        "seededIssueMatches": 5,
        "semanticDecisionAccuracyPercent": 66.67,
        "semanticDecisiveExternalFeedbackPercent": 16.67,
        "semanticEvidenceAdequacyPercent": 58.33,
        "semanticEvidenceValidation": "ADJUDICATED",
        "semanticFalsePositiveRatePercent": 50.0,
        "semanticFalsificationAdequacyPercent": 45.45,
        "semanticFindingPrecisionPercent": 80.0,
        "semanticSeededRecallPercent": 83.33,
        "totalCases": 12,
        "unresolvedCases": 0,
        "validFindings": 8
      },
      "structuralMetrics": {
        "candidateRecallPercent": 100.0,
        "completedCases": 12,
        "decisionAccuracyPercent": 58.33,
        "evidencePresencePercent": 100.0,
        "executionCoveragePercent": 100.0,
        "failedCases": 0,
        "falsePositiveRatePercent": 66.67,
        "findingPrecisionPercent": 60.0,
        "locationAccuracyPercent": 100.0,
        "rewriteRestraintPercent": 100.0,
        "semanticEvidenceValidation": "NOT_AUTOMATED",
        "totalCases": 12,
        "totalDurationMs": 553999,
        "unavailableCases": 0,
        "usage": {
          "availability": "COMPLETE",
          "reportedCases": 12,
          "reportedUsage": {
            "cacheWriteInputTokens": 0,
            "cachedInputTokens": 329216,
            "inputTokens": 494707,
            "outputTokens": 16245,
            "reasoningOutputTokens": 8321,
            "toolCalls": {
              "byType": {
                "collabToolCall": 0,
                "commandExecution": 37,
                "fileChange": 0,
                "mcpToolCall": 0,
                "webSearch": 0
              },
              "total": 37
            },
            "totalTokens": 510952,
            "turnCount": 12
          },
          "unavailableCases": 0,
          "unavailableReasons": {}
        },
        "verificationExecutionPercent": 0.0
      },
      "treatment": "ORDINARY_PROMPT"
    },
    {
      "adjudicationContentSha256": "d118f455c63c2af5bbf54ee7b80454e04fae32d5e3ae74f9e90ce572242be319",
      "goldenEligible": true,
      "runContentSha256": "6e2cd05007950321bda4bca8f6c0996ca9cc64cc9239afccc606c4396a286919",
      "runId": "rce-20260807T084925Z-c560def66361",
      "semanticMetrics": {
        "contaminatedNegativeCases": 3,
        "falsePositiveFindings": 3,
        "missedSeededIssues": 2,
        "negativeCases": 6,
        "positiveCases": 6,
        "resolvedCases": 12,
        "seededIssueMatches": 4,
        "semanticDecisionAccuracyPercent": 50.0,
        "semanticDecisiveExternalFeedbackPercent": 16.67,
        "semanticEvidenceAdequacyPercent": 58.33,
        "semanticEvidenceValidation": "ADJUDICATED",
        "semanticFalsePositiveRatePercent": 66.67,
        "semanticFalsificationAdequacyPercent": 41.67,
        "semanticFindingPrecisionPercent": 72.73,
        "semanticSeededRecallPercent": 66.67,
        "totalCases": 12,
        "unresolvedCases": 0,
        "validFindings": 8
      },
      "structuralMetrics": {
        "candidateRecallPercent": 100.0,
        "completedCases": 12,
        "decisionAccuracyPercent": 41.67,
        "evidencePresencePercent": 100.0,
        "executionCoveragePercent": 100.0,
        "failedCases": 0,
        "falsePositiveRatePercent": 83.33,
        "findingPrecisionPercent": 54.55,
        "locationAccuracyPercent": 100.0,
        "rewriteRestraintPercent": 83.33,
        "semanticEvidenceValidation": "NOT_AUTOMATED",
        "totalCases": 12,
        "totalDurationMs": 526532,
        "unavailableCases": 0,
        "usage": {
          "availability": "COMPLETE",
          "reportedCases": 12,
          "reportedUsage": {
            "cacheWriteInputTokens": 0,
            "cachedInputTokens": 335872,
            "inputTokens": 466431,
            "outputTokens": 16211,
            "reasoningOutputTokens": 8453,
            "toolCalls": {
              "byType": {
                "collabToolCall": 0,
                "commandExecution": 37,
                "fileChange": 0,
                "mcpToolCall": 0,
                "webSearch": 0
              },
              "total": 37
            },
            "totalTokens": 482642,
            "turnCount": 12
          },
          "unavailableCases": 0,
          "unavailableReasons": {}
        },
        "verificationExecutionPercent": 0.0
      },
      "treatment": "ADVERSARIAL_PROMPT"
    },
    {
      "adjudicationContentSha256": "d118f455c63c2af5bbf54ee7b80454e04fae32d5e3ae74f9e90ce572242be319",
      "goldenEligible": true,
      "runContentSha256": "ced3c1a56eef130577e4c5b0dd9cf638db8880187e10ff979327de9556fc9e2a",
      "runId": "rce-20260807T084925Z-acacd6b588c5",
      "semanticMetrics": {
        "contaminatedNegativeCases": 1,
        "falsePositiveFindings": 0,
        "missedSeededIssues": 2,
        "negativeCases": 6,
        "positiveCases": 6,
        "resolvedCases": 12,
        "seededIssueMatches": 4,
        "semanticDecisionAccuracyPercent": 83.33,
        "semanticDecisiveExternalFeedbackPercent": 0.0,
        "semanticEvidenceAdequacyPercent": 83.33,
        "semanticEvidenceValidation": "ADJUDICATED",
        "semanticFalsePositiveRatePercent": 0.0,
        "semanticFalsificationAdequacyPercent": 66.67,
        "semanticFindingPrecisionPercent": 100.0,
        "semanticSeededRecallPercent": 66.67,
        "totalCases": 12,
        "unresolvedCases": 0,
        "validFindings": 6
      },
      "structuralMetrics": {
        "candidateRecallPercent": 83.33,
        "completedCases": 12,
        "decisionAccuracyPercent": 83.33,
        "evidencePresencePercent": 83.33,
        "executionCoveragePercent": 100.0,
        "failedCases": 0,
        "falsePositiveRatePercent": 16.67,
        "findingPrecisionPercent": 83.33,
        "locationAccuracyPercent": 83.33,
        "rewriteRestraintPercent": 100.0,
        "semanticEvidenceValidation": "NOT_AUTOMATED",
        "totalCases": 12,
        "totalDurationMs": 517390,
        "unavailableCases": 0,
        "usage": {
          "availability": "COMPLETE",
          "reportedCases": 12,
          "reportedUsage": {
            "cacheWriteInputTokens": 0,
            "cachedInputTokens": 291328,
            "inputTokens": 459941,
            "outputTokens": 15893,
            "reasoningOutputTokens": 7863,
            "toolCalls": {
              "byType": {
                "collabToolCall": 0,
                "commandExecution": 36,
                "fileChange": 0,
                "mcpToolCall": 0,
                "webSearch": 0
              },
              "total": 36
            },
            "totalTokens": 475834,
            "turnCount": 12
          },
          "unavailableCases": 0,
          "unavailableReasons": {}
        },
        "verificationExecutionPercent": 0.0
      },
      "treatment": "RISK_LENS_ADVERSARIAL"
    },
    {
      "adjudicationContentSha256": "d118f455c63c2af5bbf54ee7b80454e04fae32d5e3ae74f9e90ce572242be319",
      "goldenEligible": true,
      "runContentSha256": "77041d31f64845522cd381f426496059c743df1b43c7f85f1b0331f210794ccc",
      "runId": "rce-20260807T084925Z-d000d407a3da",
      "semanticMetrics": {
        "contaminatedNegativeCases": 0,
        "falsePositiveFindings": 0,
        "missedSeededIssues": 0,
        "negativeCases": 6,
        "positiveCases": 6,
        "resolvedCases": 12,
        "seededIssueMatches": 6,
        "semanticDecisionAccuracyPercent": 91.67,
        "semanticDecisiveExternalFeedbackPercent": 100.0,
        "semanticEvidenceAdequacyPercent": 100.0,
        "semanticEvidenceValidation": "ADJUDICATED",
        "semanticFalsePositiveRatePercent": 0.0,
        "semanticFalsificationAdequacyPercent": 100.0,
        "semanticFindingPrecisionPercent": 100.0,
        "semanticSeededRecallPercent": 100.0,
        "totalCases": 12,
        "unresolvedCases": 0,
        "validFindings": 6
      },
      "structuralMetrics": {
        "candidateRecallPercent": 100.0,
        "completedCases": 12,
        "decisionAccuracyPercent": 91.67,
        "evidencePresencePercent": 100.0,
        "executionCoveragePercent": 100.0,
        "failedCases": 0,
        "falsePositiveRatePercent": 0.0,
        "findingPrecisionPercent": 100.0,
        "locationAccuracyPercent": 100.0,
        "rewriteRestraintPercent": 100.0,
        "semanticEvidenceValidation": "NOT_AUTOMATED",
        "totalCases": 12,
        "totalDurationMs": 727823,
        "unavailableCases": 0,
        "usage": {
          "availability": "COMPLETE",
          "reportedCases": 12,
          "reportedUsage": {
            "cacheWriteInputTokens": 0,
            "cachedInputTokens": 632832,
            "inputTokens": 877588,
            "outputTokens": 23896,
            "reasoningOutputTokens": 11765,
            "toolCalls": {
              "byType": {
                "collabToolCall": 0,
                "commandExecution": 57,
                "fileChange": 0,
                "mcpToolCall": 0,
                "webSearch": 0
              },
              "total": 57
            },
            "totalTokens": 901484,
            "turnCount": 12
          },
          "unavailableCases": 0,
          "unavailableReasons": {}